Change;Excluded;Original;en;it
;;"A whip that exists in multiple timelines 
simultaneously, striking the same target multiple times.";"A whip that exists in multiple timelines 
simultaneously, striking the same target multiple times.";"Una frusta che esiste in più linee temporali
contemporaneamente, colpendo lo stesso bersaglio più volte."
;;Adaptive Combat AI;Adaptive Combat AI;IA di combattimento adattiva
;;"A weapon system that learns from combat and adapts
its tactics and ammunition type.";"A weapon system that learns from combat and adapts
its tactics and ammunition type.";"Un sistema d'arma che impara dal combattimento e adatta
le sue tattiche e il tipo di munizioni."
;;Molecular Manipulator Gloves;Molecular Manipulator Gloves;Guanti manipolatori molecolari
;;"Gauntlets that allow the wearer to manipulate 
matter at the molecular level.";"Gauntlets that allow the wearer to manipulate 
matter at the molecular level.";"Guanti che consentono a chi li indossa di manipolare
la materia a livello molecolare."
;;Quantum Superposition Blade;Quantum Superposition Blade;Lama di sovrapposizione quantistica
;;"A sword that exists in a state of quantum 
superposition, striking all possible targets simultaneously.";"A sword that exists in a state of quantum 
superposition, striking all possible targets simultaneously.";"Una spada che esiste in uno stato di sovrapposizione quantistica,
colpendo simultaneamente tutti i possibili bersagli."
;;Universal Force Staff;Universal Force Staff;Bastone della Forza Universale
;;"A staff that channels the fundamental forces of 
the universe itself.";"A staff that channels the fundamental forces of 
the universe itself.";"Un bastone che canalizza le forze fondamentali dell'
universo stesso."
;;Reality Distortion Cannon;Reality Distortion Cannon;Cannone di distorsione della realtà
;;"A reality-warping weapon that can rewrite the 
laws of physics in a localized area.";"A reality-warping weapon that can rewrite the 
laws of physics in a localized area.";"Un'arma che deforma la realtà e può riscrivere le
leggi della fisica in un'area localizzata."
;;Omniadaptive Combat System;Omniadaptive Combat System;Sistema di combattimento omniadattivo
;;"The ultimate expression of combat technology, 
capable of adapting to any threat.";"The ultimate expression of combat technology, 
capable of adapting to any threat.";"La massima espressione della tecnologia di combattimento,
capace di adattarsi a qualsiasi minaccia."
;;"
[Armors]
";"
[Armors]
";[Armature]
;;Toxin Blocker;Toxin Blocker;Blocca-tossine
;;"A collection of stylish and protective clothing 
for urban environments.";"A collection of stylish and protective clothing 
for urban environments.";"Una collezione di abbigliamento elegante e protettivo
per gli ambienti urbani."
;;NanoMed Implant;NanoMed Implant;Impianto NanoMed
;;"Advanced medical device that neutralizes toxins 
and prevents muscle lockup.";"Advanced medical device that neutralizes toxins 
and prevents muscle lockup.";"Dispositivo medico avanzato che neutralizza le tossine
e previene il blocco muscolare."
;;MindShield Interface;MindShield Interface;Interfaccia MindShield
;;"Neural interface that helps prevent mental fatigue
and disorientation.";"Neural interface that helps prevent mental fatigue
and disorientation.";"Interfaccia neurale che aiuta a prevenire l'affaticamento mentale
e il disorientamento."
;;Cerebral Firewall;Cerebral Firewall;Firewall cerebrale
;;"Military prototype that provides complete neural 
protection.";"Military prototype that provides complete neural 
protection.";"Prototipo militare che fornisce una protezione neurale
completa."
;;Urban Sixth Sense;Urban Sixth Sense;Sesto senso urbano
;;"Heightens awareness of surroundings, preventing 
ambushes.";"Heightens awareness of surroundings, preventing 
ambushes.";"Aumenta la consapevolezza dell'ambiente circostante, prevenendo
imboscate."
;;Proximity Alert Garment;Proximity Alert Garment;Indumento con avviso di prossimità
;;Advanced alarm system integrated into clothing.;Advanced alarm system integrated into clothing.;"Sistema di allarme avanzato integrato
nell'abbigliamento."
;;Momentum Preserver;Momentum Preserver;Preservatore di slancio
;;"Biometric device that preserves physical momentum 
between engagements.";"Biometric device that preserves physical momentum 
between engagements.";"Dispositivo biometrico che preserva lo slancio fisico
tra un impegno e l'altro."
;;Adrenal Amplifier;Adrenal Amplifier;Amplificatore surrenale
;;"Experimental device that enhances adrenaline 
response.";"Experimental device that enhances adrenaline 
response.";"Dispositivo sperimentale che potenzia la risposta
all'adrenalina."
;;Mana Conservation Unit;Mana Conservation Unit;Unità di conservazione del Mana
;;"Advanced arcane regulation system for optimized 
performance.";"Advanced arcane regulation system for optimized 
performance.";"Sistema avanzato di regolazione arcana per prestazioni
ottimizzate."
;;Adaptive Hazard Suit;Adaptive Hazard Suit;Tuta anti-rischio adattiva
;;"Prototype clothing that adapts to environmental 
hazards.";"Prototype clothing that adapts to environmental 
hazards.";"Prototipo di abbigliamento che si adatta ai rischi
ambientali."
;;Designer Target Optics;Designer Target Optics;Occhiali target
;;"Designer eyewear with integrated target 
acquisition system.";"Designer eyewear with integrated target 
acquisition system.";Occhiali di design con sistema di acquisizione del bersaglio integrato.
;;Living Textile Outfit;Living Textile Outfit;Tessuto vivente
;;"Symbiotic fabric that repairs itself and 
strengthens with wear.";"Symbiotic fabric that repairs itself and 
strengthens with wear.";"Tessuto simbiotico che si ripara e
si rinforza con l'usura."
;;Quantum Weave Garment;Quantum Weave Garment;Indumento in tessuto quantico
;;Clothing with embedded quantum computing fibers.;Clothing with embedded quantum computing fibers.;"Abiti con fibre di calcolo quantistico
incorporate."
;;Photonic Stealth Suit;Photonic Stealth Suit;Tuta stealth fotonica
;;"Tactical outfit that bends light around the 
wearer.";"Tactical outfit that bends light around the 
wearer.";Tuta tattica che riflette la luce intorno a chi la indossa.
;;Concealed Exo-Frame;Concealed Exo-Frame;Exo-Frame nascosto
;;"Exoskeleton disguised as fashionable urban 
clothing.";"Exoskeleton disguised as fashionable urban 
clothing.";Esoscheletro travestito da abbigliamento urbano alla moda.
;;Quantum Thought Enhancer;Quantum Thought Enhancer;Potenziatore del pensiero quantistico
;;"Headgear that enhances thought processes with 
quantum computing.";"Headgear that enhances thought processes with 
quantum computing.";"Un casco che migliora i processi di pensiero grazie
all'informatica quantistica."
;;Atmospheric Controller;Atmospheric Controller;Controllore atmosferico
;;"Helmet with built-in atmospheric manipulation 
technology.";"Helmet with built-in atmospheric manipulation 
technology.";Casco con tecnologia di manipolazione atmosferica integrata.
;;Neural Interface Helmet;Neural Interface Helmet;Casco di interfaccia neurale
;;"Helmet that interfaces directly with the brain 
stem.";"Helmet that interfaces directly with the brain 
stem.";Casco che si interfaccia direttamente con il tronco encefalico.
;;Pocket Dimension Generator;Pocket Dimension Generator;Generatore di dimensioni tascabili
;;"Wearable that creates micro-dimensional pockets 
for storage.";"Wearable that creates micro-dimensional pockets 
for storage.";"Dispositivo indossabile che crea tasche microdimensionali
per riporre gli oggetti."
;;Probability Distortion Field;Probability Distortion Field;Campo di distorsione della probabilità
;;"Shield that manipulates probability fields around 
the user.";"Shield that manipulates probability fields around 
the user.";"Scudo che manipola i campi di probabilità attorno
all'utente."
;;Phase Shift Barrier;Phase Shift Barrier;Barriera di sfasamento
;;"Shield that phases between dimensions to block 
attacks.";"Shield that phases between dimensions to block 
attacks.";"Scudo che si sposta tra le dimensioni per bloccare
gli attacchi."
;;EM Field Harvester;EM Field Harvester;Convertitrice di campo EM
;;"Converts ambient electromagnetic energy into 
protective fields.";"Converts ambient electromagnetic energy into 
protective fields.";"Converte l'energia elettromagnetica ambientale in
campi protettivi."
;;Self-Repairing Attire;Self-Repairing Attire;Abbigliamento autoriparante
;;"Urban clothing infused with microscopic repair 
drones.";"Urban clothing infused with microscopic repair 
drones.";Abbigliamento urbano dotato di microscopici droni riparatori.
;;Impact-Reactive Armor;Impact-Reactive Armor;Armatura reattiva all'impatto
;;"Lightweight armor that hardens instantly on 
impact.";"Lightweight armor that hardens instantly on 
impact.";"Armatura leggera che si indurisce all'istante
all'impatto."
;;Neuro-Feedback Clothing;Neuro-Feedback Clothing;Abbigliamento Neuro-Feedback
;;"Clothing with integrated bio-feedback systems for 
enhanced cognition.";"Clothing with integrated bio-feedback systems for 
enhanced cognition.";"Abbigliamento con sistemi di biofeedback integrati per
migliorare le capacità cognitive."
;;Cotton T-Shirt;Cotton T-Shirt;Maglietta di cotone
;;"Breathable cotton t-shirt, a staple in any urban 
wardrobe.";"Breathable cotton t-shirt, a staple in any urban 
wardrobe.";"T-shirt in cotone traspirante, un capo essenziale in ogni
guardaroba urbano."
;;Denim Jacket;Denim Jacket;Giacca di jeans
;;"Durable denim jacket that offers basic protection 
from the elements.";"Durable denim jacket that offers basic protection 
from the elements.";"Giacca in denim resistente che offre una protezione di base
dagli agenti atmosferici."
;;Urban Explorer Outfit;Urban Explorer Outfit;Abito da esploratore urbano
;;"Durable clothing designed for urban explorers and 
parkour enthusiasts.";"Durable clothing designed for urban explorers and 
parkour enthusiasts.";"Abbigliamento resistente pensato per esploratori urbani e
appassionati di parkour."
;;Motorcycle Jacket;Motorcycle Jacket;Giacca da motociclista
;;Reinforced motorcycle jacket with impact padding.;Reinforced motorcycle jacket with impact padding.;"Giacca da motociclista rinforzata con imbottitura
antiurto."
;;Tactical Vest;Tactical Vest;Gilet tattico
;;"Tactical vest with kevlar inserts, popular with 
security personnel.";"Tactical vest with kevlar inserts, popular with 
security personnel.";"Gilet tattico con inserti in kevlar, molto apprezzato
dal personale di sicurezza."
;;Urban Streetwear;Urban Streetwear;Abbigliamento urbano
;;"Stylish urban streetwear with hidden protective 
features.";"Stylish urban streetwear with hidden protective 
features.";Streetwear urbano alla moda con caratteristiche protettive nascoste.
;;Athletic Wear;Athletic Wear;Abbigliamento sportivo
;;"Lightweight workout clothing with reinforced 
fibers.";"Lightweight workout clothing with reinforced 
fibers.";"Abbigliamento sportivo leggero con fibre
rinforzate."
;;Urban Leather Jacket;Urban Leather Jacket;Giacca in pelle urbana
;;"Stylish leather jacket with reinforced stitching 
and hidden pockets.";"Stylish leather jacket with reinforced stitching 
and hidden pockets.";"Elegante giacca in pelle con cuciture rinforzate
e tasche nascoste."
;;Concealed Armor Jacket;Concealed Armor Jacket;Giacca con armatura nascosta
;;"Kevlar-lined jacket disguised as casual 
streetwear.";"Kevlar-lined jacket disguised as casual 
streetwear.";"Giacca foderata in Kevlar camuffata da abbigliamento
da strada casual."
;;X-Sports Protective Gear;X-Sports Protective Gear;Equipaggiamento protettivo X-Sports
;;"Modern protective gear for extreme sports and 
urban adventures.";"Modern protective gear for extreme sports and 
urban adventures.";"Moderne protezioni per sport estremi e
avventure urbane."
;;Carbon Fiber Jacket;Carbon Fiber Jacket;Giacca in fibra di carbonio
;;"High-tech lightweight armor with carbon fiber 
inserts.";"High-tech lightweight armor with carbon fiber 
inserts.";Armatura leggera ad alta tecnologia con inserti in fibra di carbonio.
;;Urban Defender Suit;Urban Defender Suit;Tuta urban defender
;;"Ultimate urban protection made with cutting-edge 
ballistic materials.";"Ultimate urban protection made with cutting-edge 
ballistic materials.";Massima protezione urbana realizzata con materiali balistici all'avanguardia.
;;Heavy Urban Protection;Heavy Urban Protection;Protezione urbana pesante
;;"Heavy-duty protective gear for dangerous urban 
environments.";"Heavy-duty protective gear for dangerous urban 
environments.";"Dispositivi di protezione ad alta resistenza per ambienti urbani
pericolosi."
;;Security Uniform;Security Uniform;Uniforme da guardia giurata
;;"Security guard uniform with basic protective 
features.";"Security guard uniform with basic protective 
features.";"Uniforme da guardia giurata con caratteristiche
protettive di base."
;;Riot Gear;Riot Gear;Attrezzatura antisommossa
;;"Heavy-duty tactical vest with multiple layers of 
protection.";"Heavy-duty tactical vest with multiple layers of 
protection.";"Gilet tattico resistente con più strati di
protezione."
;;Composite Body Armor;Composite Body Armor;Giubbotto antiproiettile composito
;;Advanced body armor with composite materials.;Advanced body armor with composite materials.;"Giubbotto antiproiettile avanzato con materiali
compositi."
;;Urban Assault Armor;Urban Assault Armor;Armatura d'assalto urbana
;;"Military-grade full body armor with maximum 
protection.";"Military-grade full body armor with maximum 
protection.";"Giubbotto antiproiettile completo di livello militare con la massima
protezione."
;;Tech Specialist Gear;Tech Specialist Gear;Attrezzatura specialistica tecnica
;;"Specialized clothing for tech specialists and 
hackers.";"Specialized clothing for tech specialists and 
hackers.";"Abbigliamento specializzato per tecnici e
hacker."
;;Tech Hoodie;Tech Hoodie;Felpan Tech
;;"Comfortable hoodie with built-in tech pockets and 
wire management.";"Comfortable hoodie with built-in tech pockets and 
wire management.";"Comoda felpa con cappuccio, tasche tecnologiche integrate e 
passacavo."
;;Hacker's Jacket;Hacker's Jacket;Giacca da hacker
;;"High-quality jacket with EMF protection and hidden
device pockets.";"High-quality jacket with EMF protection and hidden
device pockets.";Giacca di alta qualità con protezione EMF e tasche nascoste per dispositivi.
;;Data Analyst Coat;Data Analyst Coat;Cappotto da analista dati
;;"Data analyst coat with augmented reality interface
capabilities.";"Data analyst coat with augmented reality interface
capabilities.";Cappotto per analista dati con funzionalità di interfaccia di realtà aumentata.
;;Cybernetic Suit;Cybernetic Suit;Tuta cibernetica
;;"Advanced tech-integrated clothing with cooling 
systems for extended use.";"Advanced tech-integrated clothing with cooling 
systems for extended use.";"Abbigliamento tecnologico avanzato con sistemi di raffreddamento
per un uso prolungato."
;;Digital Mage Suit;Digital Mage Suit;Tuta da mago digitale
;;"Cutting-edge outfit with integrated computer 
systems and holographic interfaces.";"Cutting-edge outfit with integrated computer 
systems and holographic interfaces.";"Attrezzatura all'avanguardia con sistemi informatici integrati
e interfacce olografiche."
;;Urban Defense Tools;Urban Defense Tools;Strumenti di difesa urbana
;;Modern defensive accessories for urban survival.;Modern defensive accessories for urban survival.;"Moderni accessori difensivi per la sopravvivenza
urbana."
;;Urban Shields;Urban Shields;Scudi urbani
;;"Various shields and defensive items for urban 
combat.";"Various shields and defensive items for urban 
combat.";"Vari scudi e oggetti difensivi per il combattimento
urbano."
;;Tactical Shield;Tactical Shield;Scudo tattico
;;"Compact tactical shield designed for urban 
self-defense.";"Compact tactical shield designed for urban 
self-defense.";Scudo tattico compatto progettato per l'autodifesa urbana.
;;Carbon Fiber Shield;Carbon Fiber Shield;Scudo in fibra di carbonio
;;Reinforced carbon fiber shield for riot defense.;Reinforced carbon fiber shield for riot defense.;"Scudo rinforzato in fibra di carbonio per la
difesa antisommossa."
;;Shock Shield;Shock Shield;Scudo antiurto
;;"Portable shield with electric shock deterrent 
system.";"Portable shield with electric shock deterrent 
system.";Scudo portatile con sistema di deterrenza contro le scosse elettriche.
;;Impact Disperser;Impact Disperser;Dispersore d'impatto
;;"Advanced lightweight shield with impact-dispersing
technology.";"Advanced lightweight shield with impact-dispersing
technology.";"Scudo leggero avanzato con tecnologia di dispersione
dell'impatto."
;;Active Defense System;Active Defense System;Sistema di difesa attiva
;;"State-of-the-art tactical shield with active 
defense systems.";"State-of-the-art tactical shield with active 
defense systems.";"Scudo tattico all'avanguardia con sistemi di difesa
attivi."
;;Security Shield;Security Shield;Scudo di sicurezza
;;"Standard security shield used by mall security and
private guards.";"Standard security shield used by mall security and
private guards.";"Scudo di sicurezza standard utilizzato dalla sicurezza dei centri commerciali e
dalle guardie private."
;;Crowd Control Shield;Crowd Control Shield;Scudo di controllo della folla
;;"Heavy-duty shield designed for crowd control 
situations.";"Heavy-duty shield designed for crowd control 
situations.";Scudo resistente progettato per situazioni di controllo della folla.
;;Ballistic Shield;Ballistic Shield;Scudo balistico
;;Reinforced ballistic shield with viewing window.;Reinforced ballistic shield with viewing window.;"Scudo balistico rinforzato con finestra di
visualizzazione."
;;Smart Shield;Smart Shield;Scudo intelligente
;;"Advanced tactical shield with integrated computer 
systems.";"Advanced tactical shield with integrated computer 
systems.";Scudo tattico avanzato con sistemi informatici integrati.
;;Reactive Armor Shield;Reactive Armor Shield;Scudo corazzato reattivo
;;"Ultimate protection system with reactive armor 
plating.";"Ultimate protection system with reactive armor 
plating.";Sistema di protezione definitivo con corazzatura reattiva.
;;Digital Defense Tools;Digital Defense Tools;Strumenti di difesa digitale
;;"Digital protective tools for the tech-savvy 
urbanite.";"Digital protective tools for the tech-savvy 
urbanite.";"Strumenti di protezione digitale per gli abitanti
urbani esperti di tecnologia."
;;Digital Amulet;Digital Amulet;Amuleto digitale
;;"Wearable tech that protects against basic digital 
attacks.";"Wearable tech that protects against basic digital 
attacks.";Tecnologia indossabile che protegge dagli attacchi digitali di base.
;;Data Shield;Data Shield;Scudo dati
;;Wrist-mounted device that shields personal data.;Wrist-mounted device that shields personal data.;"Dispositivo da polso che protegge i dati
personali."
;;Personal Firewall;Personal Firewall;Firewall personale
;;Personal firewall device worn on the wrist.;Personal firewall device worn on the wrist.;"Dispositivo firewall personale da indossare al
polso."
;;Digital Field Generator;Digital Field Generator;Generatore di campo digitale
;;"Advanced tech that creates a digital protective 
field.";"Advanced tech that creates a digital protective 
field.";Tecnologia avanzata che crea un campo protettivo digitale.
;;Quantum Encryption Device;Quantum Encryption Device;Dispositivo di crittografia quantistica
;;"Cutting-edge counter-surveillance system with 
encryption technology.";"Cutting-edge counter-surveillance system with 
encryption technology.";"Sistema di controsorveglianza all'avanguardia con
tecnologia di crittografia."
;;Urban Headgear;Urban Headgear;Copricapo urbano
;;Modern headgear for urban protection and style.;Modern headgear for urban protection and style.;Copricapo moderno per protezione e stile in città.
;;Urban Headwear;Urban Headwear;Copricapi urbani
;;Protective headgear for modern urban environments.;Protective headgear for modern urban environments.;"Copricapo protettivo per gli ambienti urbani
moderni."
;;Sports Headband;Sports Headband;Fascia sportiva
;;"Simple cloth headband that keeps sweat out of your
eyes.";"Simple cloth headband that keeps sweat out of your
eyes.";"Semplice fascia in tessuto che protegge
gli occhi dal sudore."
;;Urban Bandana;Urban Bandana;Bandana urbana
;;"Stylish bandana that provides minimal protection 
against the elements.";"Stylish bandana that provides minimal protection 
against the elements.";"Bandana elegante che offre una protezione minima
contro gli elementi."
;;Street Hat;Street Hat;Cappello da strada
;;"Trendy hat that offers protection from sun and 
minor impacts.";"Trendy hat that offers protection from sun and 
minor impacts.";"Cappello alla moda che offre protezione dal sole e
da piccoli urti."
;;Reinforced Beanie;Reinforced Beanie;Berretto rinforzato
;;"Comfortable beanie with thin kevlar weave for 
protection.";"Comfortable beanie with thin kevlar weave for 
protection.";"Comodo berretto con sottile trama in kevlar per
protezione."
;;Designer Safety Cap;Designer Safety Cap;Tappo di sicurezza di design
;;Designer hat with hidden protective features.;Designer hat with hidden protective features.;"Cappello da designer con caratteristiche
protettive nascoste."
;;Active Urban Headgear;Active Urban Headgear;Copricapo urbano attivo
;;"Lightweight protective headgear for active 
urbanites.";"Lightweight protective headgear for active 
urbanites.";"Copricapo protettivo leggero per chi vive
in città in modo attivo."
;;Bike Helmet;Bike Helmet;Casco da bici
;;Basic bicycle helmet for everyday urban cycling.;Basic bicycle helmet for everyday urban cycling.;"Casco da bicicletta di base per l'uso quotidiano
in città."
;;Skater Helmet;Skater Helmet;Casco da skate
;;"Lightweight helmet popular with skateboarders and 
BMX riders.";"Lightweight helmet popular with skateboarders and 
BMX riders.";"Casco leggero, apprezzato dagli skater e
dai rider di BMX."
;;X-Sports Helmet;X-Sports Helmet;Casco X-Sports
;;"Impact-resistant sports helmet for urban extreme 
sports.";"Impact-resistant sports helmet for urban extreme 
sports.";"Casco sportivo resistente agli urti per sport estremi
urbani."
;;Motorcycle Helmet;Motorcycle Helmet;Casco da motociclista
;;"Advanced motorcycle helmet with integrated 
communication system.";"Advanced motorcycle helmet with integrated 
communication system.";"Casco da moto avanzato con sistema di
comunicazione integrato."
;;Carbon Fiber Helmet;Carbon Fiber Helmet;Casco in fibra di carbonio
;;"High-tech protective helmet with lightweight 
carbon fiber shell.";"High-tech protective helmet with lightweight 
carbon fiber shell.";"Casco protettivo ad alta tecnologia con calotta leggera
in fibra di carbonio."
;;Urban Defender Helmet;Urban Defender Helmet;Casco Urban Defender
;;"Ultimate urban protection helmet with 
impact-dispersing technology.";"Ultimate urban protection helmet with 
impact-dispersing technology.";"Casco di massima protezione urbana con
tecnologia antiurto."
;;Heavy Urban Helmets;Heavy Urban Helmets;Caschi urbani pesanti
;;Heavy-duty helmets for maximum head protection.;Heavy-duty helmets for maximum head protection.;"Caschi resistenti per la massima protezione della
testa."
;;Hard Hat;Hard Hat;Casco di sicurezza
;;"Basic protective headgear used by construction 
workers.";"Basic protective headgear used by construction 
workers.";"Casco protettivo di base utilizzato dai
lavoratori edili."
;;Security Helmet;Security Helmet;Casco di sicurezza
;;"Reinforced tactical helmet used by security 
personnel.";"Reinforced tactical helmet used by security 
personnel.";Elmetto tattico rinforzato utilizzato dal personale di sicurezza.
;;Riot Helmet;Riot Helmet;Casco antisommossa
;;"Heavy-duty helmet with face shield for riot 
control.";"Heavy-duty helmet with face shield for riot 
control.";"Casco resistente con visiera per il controllo
antisommossa."
;;Tactical Ops Helmet;Tactical Ops Helmet;Casco tattico per operazioni
;;"Advanced tactical helmet with integrated 
communications.";"Advanced tactical helmet with integrated 
communications.";"Casco tattico avanzato con
comunicazioni integrate."
;;Ballistic Helmet;Ballistic Helmet;Casco balistico
;;"Military-grade ballistic helmet with multiple 
protective features.";"Military-grade ballistic helmet with multiple 
protective features.";"Elmetto balistico di livello militare con molteplici
caratteristiche protettive."
;;Tech Headgear;Tech Headgear;Copricapo tecnico
;;"Tech-enhanced headgear for the digital urban 
warrior.";"Tech-enhanced headgear for the digital urban 
warrior.";"Copricapo tecnologicamente avanzato per il guerriero urbano
digitale."
;;AR Headset;AR Headset;Visore AR
;;Headset with augmented reality capabilities.;Headset with augmented reality capabilities.;Visore con funzionalità di realtà aumentata.
;;Neural Band;Neural Band;Banda neurale
;;"High-tech headband with integrated computing 
functions.";"High-tech headband with integrated computing 
functions.";Fascia high-tech con funzioni informatiche integrate.
;;Data Processor;Data Processor;Cuffie processanti
;;"Advanced headset with enhanced data processing 
capabilities.";"Advanced headset with enhanced data processing 
capabilities.";Cuffie avanzate con capacità di elaborazione dati avanzate.
;;AR Visor Pro;AR Visor Pro;Visore AR Pro
;;"High-end augmented reality visor with multiple 
functions.";"High-end augmented reality visor with multiple 
functions.";"Visore di realtà aumentata di fascia alta con molteplici
funzioni."
;;Holo-Interface;Holo-Interface;Interfaccia olografica
;;"Advanced holographic interface headset with AI 
assistance.";"Advanced holographic interface headset with AI 
assistance.";"Visore con interfaccia olografica avanzata con assistenza 
IA."
;;Neural Crown;Neural Crown;Corona neurale
