Change;Excluded;Original;en;it
;;"Creates unity among all allies,
dramatically increasing all their defensive stats.";"Creates unity among all allies,
dramatically increasing all their defensive stats.";"Crea unità tra tutti gli alleati,
aumentando notevolmente tutte le loro statistiche difensive."
;;%1 creates unity among allies!;%1 creates unity among allies!;%1 crea unità tra gli alleati!
;;Seductive Charm;Seductive Charm;Fascino seducente
;;"Charms an enemy with a seductive smile,
causing them to temporarily join your side.";"Charms an enemy with a seductive smile,
causing them to temporarily join your side.";"Ammalia un nemico con un sorriso seducente,
inducendolo a schierarsi temporaneamente dalla tua parte."
;;%1 uses seductive charm!;%1 uses seductive charm!;%1 usa un fascino seducente!
;;Critical Insights;Critical Insights;Approfondimenti critici
;;"Provides tactical insights that greatly increase
the critical hit rate for all allies.";"Provides tactical insights that greatly increase
the critical hit rate for all allies.";"Fornisce spunti tattici che aumentano notevolmente
la probabilità di colpire in modo critico per tutti gli alleati."
;;%1 shares critical insights!;%1 shares critical insights!;%1 condivide intuizioni critiche!
;;Negotiated Truce;Negotiated Truce;Tregua negoziata
;;"Negotiates with an enemy, making them
less likely to attack your weakest ally.";"Negotiates with an enemy, making them
less likely to attack your weakest ally.";"Negozia con un nemico, rendendolo
meno propenso ad attaccare il tuo alleato più debole."
;;%1 negotiates a truce!;%1 negotiates a truce!;%1 negozia una tregua!
;;Taunt Diversion;Taunt Diversion;Divergenza di provocazione
;;"Creates a diversion that makes all
enemies target you instead of allies.";"Creates a diversion that makes all
enemies target you instead of allies.";"Crea un diversivo che fa sì che tutti
i nemici prendano di mira te invece degli alleati."
;;%1 creates a diversion!;%1 creates a diversion!;%1 crea una deviazione!
;;Morale Boost;Morale Boost;Incremento del morale
;;"Boosts an ally's morale, healing
their HP and increasing their Attack.";"Boosts an ally's morale, healing
their HP and increasing their Attack.";"Aumenta il morale di un alleato,
restituendogli i PV e aumentandone l'Attacco."
;;%1 boosts morale!;%1 boosts morale!;%1 aumenta il morale!
;;Heroic Rally;Heroic Rally;Raduno eroico
;;"Passionately rallies all allies, 
massively increasing all their stats.";"Passionately rallies all allies, 
massively increasing all their stats.";"Raduna con passione tutti gli alleati,
aumentando notevolmente tutte le loro statistiche."
;;%1 delivers a heroic rally!;%1 delivers a heroic rally!;%1 realizza una manifestazione eroica!
;;Crushing Demoralization;Crushing Demoralization;Demoralizzazione schiacciante
;;"Delivers a devastating speech that
massively decreases all stats.";"Delivers a devastating speech that
massively decreases all stats.";"Pronuncia un discorso devastante che
diminuisce drasticamente tutte le statistiche."
;;%1 delivers a demoralizing speech!;%1 delivers a demoralizing speech!;%1 declama un discorso demoralizzante!
;;Tactical Advice;Tactical Advice;Consigli tattici
;;"Shares tactical knowledge that increases
the DEX of all allies.";"Shares tactical knowledge that increases
the DEX of all allies.";"Condivide conoscenze tattiche che aumentano
la DES di tutti gli alleati."
;;%1 shares tactical knowledge!;%1 shares tactical knowledge!;%1 condivide la conoscenza tattica!
;;Team Coordination;Team Coordination;Coordinamento del team
;;"Boosts team coordination, increasing
the DEX of all allies.";"Boosts team coordination, increasing
the DEX of all allies.";"Migliora il coordinamento della squadra, aumentando
la DEX di tutti gli alleati."
;;%1 coordinates the team!;%1 coordinates the team!;%1 coordina il team!
;;Defensive Tactics;Defensive Tactics;Tattiche difensive
;;"Shares defensive strategies that increase
the COS of all allies.";"Shares defensive strategies that increase
the COS of all allies.";"Condivide strategie difensive che aumentano
il COS di tutti gli alleati."
;;%1 shares defensive strategies!;%1 shares defensive strategies!;%1 condivide strategie difensive!
;;Self-Actualization;Self-Actualization;Auto-realizzazione
;;"Focuses inner potential, dramatically increasing
all personal stats for 3 turns.";"Focuses inner potential, dramatically increasing
all personal stats for 3 turns.";"Concentra il potenziale interiore, aumentando drasticamente
tutte le statistiche personali per 3 turni."
;;%1 focuses their potential!;%1 focuses their potential!;%1 concentra il proprio potenziale!
;;Motivational Speech;Motivational Speech;Discorso motivazionale
;;"Delivers a motivational speech that
increases all stats for all allies.";"Delivers a motivational speech that
increases all stats for all allies.";"Tiene un discorso motivazionale che
aumenta tutte le statistiche di tutti gli alleati."
;;%1 gives a motivational speech!;%1 gives a motivational speech!;%1 fa un discorso motivazionale!
;;Intimidation;Intimidation;Intimidazione
;;"Uses intimidation to decrease
an enemy's Attack and COS.";"Uses intimidation to decrease
an enemy's Attack and COS.";"Utilizza l'intimidazione per ridurre
l'Attacco e il COS di un nemico."
;;%1 intimidates the enemy!;%1 intimidates the enemy!;%1 intimidisce il nemico!
;;Mental Disruption;Mental Disruption;Interruzione mentale
;;"Uses mental disruption techniques to decrease
all enemies' INT and SAG.";"Uses mental disruption techniques to decrease
all enemies' INT and SAG.";"Utilizza tecniche di disturbo mentale per ridurre
l'INT e il SAG di tutti i nemici."
;;%1 disrupts concentration!;%1 disrupts concentration!;%1 interrompe la concentrazione!
;;Provocation;Provocation;Provocazione
;;"Taunts enemies to decrease
their DEX and PSI";"Taunts enemies to decrease
their DEX and PSI";"Provoca i nemici per diminuire
la loro DES e PSI"
;;%1 taunts the enemies!;%1 taunts the enemies!;%1 provoca i nemici!
;;Psychological Warfare;Psychological Warfare;Guerra psicologica
;;"Uses psychological techniques to decrease
all stats of an enemy.";"Uses psychological techniques to decrease
all stats of an enemy.";"Utilizza tecniche psicologiche per ridurre
tutte le statistiche di un nemico."
;;%1 uses psychological warfare!;%1 uses psychological warfare!;%1 usa la guerra psicologica!
;;Confusing Compliment;Confusing Compliment;Complimento confuso
;;"Unexpectedly compliments an enemy, increasing
their Attack but lowering their COS.";"Unexpectedly compliments an enemy, increasing
their Attack but lowering their COS.";"Completa inaspettatamente un nemico, aumentando
il suo Attacco ma riducendone il COS."
;;%1 gives a confusing compliment!;%1 gives a confusing compliment!;%1 fa un complimento confuso!
;;Overconfidence;Overconfidence;Hyperconfidenza
;;"Boosts an enemy's confidence but makes them
reckless.";"Boosts an enemy's confidence but makes them
reckless.";"Aumenta la fiducia del nemico, ma lo rende
spericolato."
;;%1 makes the enemy overconfident!;%1 makes the enemy overconfident!;%1 rende il nemico troppo sicuro di sé!
;;Defensive Overcaution;Defensive Overcaution;Eccessiva precauzione difensiva
;;"Shares tactical advice with an enemy,
increasing their COS but slowing their DEX.";"Shares tactical advice with an enemy,
increasing their COS but slowing their DEX.";"Condivide consigli tattici con un nemico,
aumentando il suo COS ma rallentando la sua DES."
;;%1 causes defensive overcaution!;%1 causes defensive overcaution!;%1 provoca un eccesso di cautela difensiva!
;;Reverse psychology;Reverse psychology;Psicologia inversa
;;"Uses reverse psychology to confuse an
enemy but increase their STR.";"Uses reverse psychology to confuse an
enemy but increase their STR.";"Utilizza la psicologia inversa per confondere un
nemico ma aumentarne la FOR."
;;%1 uses careful aiming suggestion!;%1 uses careful aiming suggestion!;%1 condivide suggerimenti!
;;Genuine Encouragement;Genuine Encouragement;Incoraggiamento genuino
;;"Genuinely encourages an enemy,
boosting all their stats slightly.";"Genuinely encourages an enemy,
boosting all their stats slightly.";"Incoraggia davvero un nemico,
aumentandone leggermente tutte le statistiche."
;;%1 genuinely encourages the enemy!;%1 genuinely encourages the enemy!;%1 incoraggia davvero il nemico!
;;Temporary Alliance;Temporary Alliance;Alleanza temporanea
;;"Forms a temporary alliance with an
enemy, increasing their COS and SAG.";"Forms a temporary alliance with an
enemy, increasing their COS and SAG.";"Forma un'alleanza temporanea con un
nemico, aumentandone il COS e il SAG."
;;%1 proposes a temporary alliance!;%1 proposes a temporary alliance!;%1 propone un'alleanza temporanea!
;;Mixed Tactics;Mixed Tactics;Tattiche miste
;;"Shares tactical knowledge with all enemies,
increasing their COS but decreasing their DEX.";"Shares tactical knowledge with all enemies,
increasing their COS but decreasing their DEX.";"Condivide le conoscenze tattiche con tutti i nemici,
aumentando il loro COS ma diminuendo la loro DES."
;;%1 offers tactical knowledge to enemies!;%1 offers tactical knowledge to enemies!;%1 offre conoscenze tattiche ai nemici!
;;Deceptive Lullaby;Deceptive Lullaby;Ninna nanna ingannevole
;;"Sings a calming song that increases all
enemies' SAG but puts them to sleep.";"Sings a calming song that increases all
enemies' SAG but puts them to sleep.";"Canta una canzone rilassante che aumenta
il SAG di tutti i nemici, ma li fa addormentare."
;;Berserk Encouragement;Berserk Encouragement;Incoraggiamento Berserk
;;"Dramatically increases the Attack and INT of
an ally but decreases their COS and SAG.";"Dramatically increases the Attack and INT of
an ally but decreases their COS and SAG.";"Aumenta notevolmente l'Attacco e l'INT di
un alleato, ma ne diminuisce il COS e il SAG."
;;%1 activates berserk mode!;%1 activates berserk mode!;%1 attiva la modalità berserk!
;;Precision Focus;Precision Focus;Focus di precisione
;;"Dramatically increases an ally's Accuracy
and PSI but decreases their Attack.";"Dramatically increases an ally's Accuracy
and PSI but decreases their Attack.";"Aumenta notevolmente la Precisione
e il PSI di un alleato, ma ne diminuisce l'Attacco."
;;%1 activates precise mode!;%1 activates precise mode!;%1 focalizza il persaglio!
;;Predator's Bite;Predator's Bite;Morso del predatore
;;"A powerful bite attack
that deals physical damage.";"A powerful bite attack
that deals physical damage.";"Un potente attacco con morso
che infligge danni fisici."
;;%1 unleashes a ferocious bite!;%1 unleashes a ferocious bite!;%1 morde il nemico
;;Razor Claws;Razor Claws;Artigli Rasoio
;;"Sharp claws tear into
the enemy, causing bleeding damage.";"Sharp claws tear into
the enemy, causing bleeding damage.";"Artigli affilati lacerano
il nemico, causando danni da sanguinamento."
;;%1 slashes with razor claws!;%1 slashes with razor claws!;%1 colpisce con artigli affilati!
;;Hind Kick;Hind Kick;Calcio posteriore
;;"Rapid kicks that hit
an enemy multiple times.";"Rapid kicks that hit
an enemy multiple times.";"Calci rapidi che colpiscono
un nemico più volte."
;;%1 delivers powerful kicks!;%1 delivers powerful kicks!;%1 sferra calci potenti!
;;Gore Attack;Gore Attack;Incornata
;;"A crushing attack using
massive horns or antlers.";"A crushing attack using
massive horns or antlers.";"Un attacco devastante con
corna o palchi enormi."
;;%1 gores with mighty horns!;%1 gores with mighty horns!;%1 attacca con corna possenti!
;;Charging Tackle;Charging Tackle;Carica impattante
;;"Charges at full speed
to deliver a powerful impact.";"Charges at full speed
to deliver a powerful impact.";"Carica a tutta velocità
per avere un impatto potente."
;;%1 charges at full speed!;%1 charges at full speed!;%1 carica a piena velocità!
;;Blinding Screen;Blinding Screen;Nuvola accecante
;;"Temporarily blinds enemies by kicking up
dirt or creating a cloud of ink.";"Temporarily blinds enemies by kicking up
dirt or creating a cloud of ink.";"Acceca temporaneamente i nemici sollevando
terra o creando una nuvola di inchiostro."
;;%1 creates a blinding cloud!;%1 creates a blinding cloud!;%1 crea una nuvola accecante!
;;Toxic Venom;Toxic Venom;Veleno tossico
;;"Sprays or secretes a
toxic substance that poisons enemies.";"Sprays or secretes a
toxic substance that poisons enemies.";"Spruzza o secerne una
sostanza tossica che avvelena i nemici."
;;%1 sprays toxic venom!;%1 sprays toxic venom!;%1 spruzza veleno tossico!
;;Sonic Disorientation;Sonic Disorientation;Disorientamento sonoro
;;"Emits a disorienting
sound that confuses enemies.";"Emits a disorienting
sound that confuses enemies.";"Emette un suono disorientante
che confonde i nemici."
;;%1 emits a disorienting sound!;%1 emits a disorienting sound!;%1 emette un suono disorientante!
;;Paralyzing Sting;Paralyzing Sting;Puntura paralizzante
;;"Paralyzes prey with a
stinger or electric shock.";"Paralyzes prey with a
stinger or electric shock.";"Paralizza la preda con un
pungiglione o una scossa elettrica."
;;%1 delivers a paralyzing sting!;%1 delivers a paralyzing sting!;%1 infligge una puntura paralizzante!
;;Life Drain;Life Drain;Assorbi umori
;;"Drains blood or life energy
from a target to restore HP.";"Drains blood or life energy
from a target to restore HP.";"Prosciuga sangue o energia vitale
da un bersaglio per ripristinare i PV."
;;%1 drains life energy!;%1 drains life energy!;%1 drena l'energia vitale!
;;Entangle;Entangle;Intrappola
;;"Entangles the opponent in webbing,
vines, or tentacles, restricting movement.";"Entangles the opponent in webbing,
vines, or tentacles, restricting movement.";"Intrappola l'avversario in ragnatele,
liane o tentacoli, limitandone i movimenti."
;;%1 entangles the target!;%1 entangles the target!;%1 intrappola il bersaglio!
;;Wing Gust;Wing Gust;Raffica d'ala
;;"Rapidly flaps wings to create powerful
gusts of wind that damage enemies.";"Rapidly flaps wings to create powerful
gusts of wind that damage enemies.";"Sbatte rapidamente le ali per creare potenti
raffiche di vento che danneggiano i nemici."
;;%1 creates powerful wind gusts!;%1 creates powerful wind gusts!;%1 crea potenti raffiche di vento!
;;Hypnotic Mesmerize;Hypnotic Mesmerize;Mesmerizzazione ipnotica
;;"Mesmerizes the target with a hypnotic
pattern or sound, putting them to sleep.";"Mesmerizes the target with a hypnotic
pattern or sound, putting them to sleep.";"Ipnotizza il bersaglio con uno schema o un suono
ipnotico, facendolo addormentare."
;;%1 uses hypnotic mesmerization!;%1 uses hypnotic mesmerization!;%1 mesmerizza il nemico!
;;Venomous Strike;Venomous Strike;Colpo velenoso
;;"Strikes with a venomous
barb, causing damage and poison.";"Strikes with a venomous
barb, causing damage and poison.";"Colpisce con una punta
velenosa, causando danni e avvelenamento."
;;%1 strikes with a venomous tail!;%1 strikes with a venomous tail!;%1 colpisce con un pungiglione velenoso!
;;Electric Shock;Electric Shock;Scossa elettrica
;;"Unleashes a powerful electric shock
that may paralyze the target.";"Unleashes a powerful electric shock
that may paralyze the target.";"Scatena una potente scossa elettrica
che può paralizzare il bersaglio."
;;%1 delivers an electric shock!;%1 delivers an electric shock!;%1 scatena una scossa elettrica!
;;Inferno Breath;Inferno Breath;Respiro infernale
;;"Unleash a devastating stream of 
concentrated flame that ignites enemies";"Unleash a devastating stream of 
concentrated flame that ignites enemies";"Scatena un devastante flusso di
fiamme concentrate che incendiano i nemici"
;;Frost Breath;Frost Breath;Alito di gelo
;;"Breathes a freezing blast
that damages and slows enemies.";"Breathes a freezing blast
that damages and slows enemies.";"Soffia un'ondata gelida
che danneggia e rallenta i nemici."
;;%1 breathes frost!;%1 breathes frost!;%1 respira gelo!
;;Tail Smash;Tail Smash;Colpo di coda
;;"Delivers a crushing blow
with a powerful tail.";"Delivers a crushing blow
with a powerful tail.";"Sferra un colpo devastante
con una coda potente."
;;%1 smashes with its tail!;%1 smashes with its tail!;%1 colpisce con la coda!
;;Tentacle Barrage;Tentacle Barrage;Sbarramento tentacolare
;;"Attacks with multiple tentacles,
hitting the target several times.";"Attacks with multiple tentacles,
hitting the target several times.";"Attacca con più tentacoli,
colpendo il bersaglio più volte."
;;%1 attacks with tentacles!;%1 attacks with tentacles!;%1 attacca con i tentacoli!
;;Pressurized Water Jet;Pressurized Water Jet;Getto d'acqua pressurizzato
;;"Shoots a powerful jet
of water at high pressure.";"Shoots a powerful jet
of water at high pressure.";"Spara un potente getto
d'acqua ad alta pressione."
;;%1 fires a water jet!;%1 fires a water jet!;%1 spara un getto d'acqua!
;;Earthquake Stomp;Earthquake Stomp;Pestone terremoto
;;"Causes the ground to
shake, damaging all enemies.";"Causes the ground to
shake, damaging all enemies.";"Fa tremare il terreno,
danneggiando tutti i nemici."
;;%1 creates an earthquake!;%1 creates an earthquake!;%1 pesta il terreno e crea un terremoto!
;;Ambush Pounce;Ambush Pounce;Agguato sinistro
;;"Suddenly pounces on prey
with incredible speed and power.";"Suddenly pounces on prey
with incredible speed and power.";"Si avventa improvvisamente sulla preda
con incredibile velocità e potenza."
;;%1 pounces with lightning speed!;%1 pounces with lightning speed!;%1 si avventa alla velocità della luce!
;;Terrifying Roar;Terrifying Roar;Ruggito terrificante
;;"A devastating roar that
damages and intimidates all enemies.";"A devastating roar that
damages and intimidates all enemies.";"Un ruggito devastante che
danneggia e intimorisce tutti i nemici."
;;%1 lets out a devastating roar!;%1 lets out a devastating roar!;%1 emette un ruggito devastante!
;;Sonic Screech;Sonic Screech;Stridio sonico
;;"Emits a high-frequency screech
that damages and disables enemies.";"Emits a high-frequency screech
that damages and disables enemies.";"Emette uno stridio ad alta frequenza
che danneggia e stordisce i nemici."
;;%1 emits a piercing screech!;%1 emits a piercing screech!;%1 emette uno stridio penetrante!
;;Healing Secretion;Healing Secretion;Secrezione curativa
;;"Secretes a healing substance
that cures status ailments.";"Secretes a healing substance
that cures status ailments.";"Secerne una sostanza curativa
che cura i disturbi di stato."
;;%1 secretes healing enzymes!;%1 secretes healing enzymes!;%1 secerne enzimi curativi!
;;Camouflage;Camouflage;Camuffamento
;;"Changes color or form to
blend with surroundings, increasing PSI.";"Changes color or form to
blend with surroundings, increasing PSI.";"Cambia colore o forma per
mimetizzarsi con l'ambiente circostante, aumentando il PSI."
;;%1 camouflages itself!;%1 camouflages itself!;%1 si mimetizza!
;;Berserk Frenzy;Berserk Frenzy;Frenesia Berserk
;;"A furious frenzy of
attacks when cornered or threatened.";"A furious frenzy of
attacks when cornered or threatened.";"Una furiosa frenesia di
attacchi quando si è alle strette o minacciati."
;;%1 enters a frenzied state!;%1 enters a frenzied state!;%1 entra in uno stato frenetico!
;;Pack Call;Pack Call;Chiamata del branco
;;"Calls nearby allies of the
same species to join the fight.";"Calls nearby allies of the
same species to join the fight.";"Chiama gli alleati vicini della
stessa specie a unirsi alla lotta."
;;%1 calls for reinforcements!;%1 calls for reinforcements!;%1 chiama rinforzi!
;;Apex Predator Strike;Apex Predator Strike;Colpo Apex
;;"The ultimate predator attack that deals
massive damage to a single target.";"The ultimate predator attack that deals
massive damage to a single target.";"L'attacco predatore definitivo che infligge
danni ingenti a un singolo bersaglio."
;;%1 unleashes a deadly strike!;%1 unleashes a deadly strike!;%1 scatena un attacco apex!
;;Throat Bite;Throat Bite;Morso alla gola
;;"A vicious attack that targets
the throat of an enemy.";"A vicious attack that targets
the throat of an enemy.";"Un attacco feroce che prende di mira
la gola di un nemico."
;;%1 attacks the throat!;%1 attacks the throat!;%1 attacca la gola!
;;VoidTendrils;VoidTendrils;Vuoti Viticci
;;"Summons shadowy tendrils from another dimension
that grasp and damage the target.";"Summons shadowy tendrils from another dimension
that grasp and damage the target.";"Evoca tentacoli oscuri da un'altra dimensione
che afferrano e danneggiano il bersaglio."
;;%1 summons void tendrils!;%1 summons void tendrils!;%1 evoca viticci del vuoto!
;;StarfallFragment;StarfallFragment;Frammento Stellare
;;"Manifests a fragment of a
star that explodes with cosmic light.";"Manifests a fragment of a
star that explodes with cosmic light.";"Manifesta un frammento di una
stella che esplode di luce cosmica."
;;%1 creates a star fragment!;%1 creates a star fragment!;%1 crea un frammento di stella!
;;RealityDistortion;RealityDistortion;DistorciRealtà
;;"Creates a prismatic field that
distorts reality, causing unpredictable damage.";"Creates a prismatic field that
distorts reality, causing unpredictable damage.";"Crea un campo prismatico che
distorce la realtà, causando danni imprevedibili."
;;%1 distorts reality!;%1 distorts reality!;%1 distorce la realtà!
;;DevouringRift;DevouringRift;Fenditura Divorante
;;"Opens a small rift that devours
a quarter of the target's life force.";"Opens a small rift that devours
a quarter of the target's life force.";"Apre una piccola fessura che divora
un quarto della forza vitale del bersaglio."
;;%1 opens a devouring rift!;%1 opens a devouring rift!;%1 apre una fenditura divoratrice!
;;SensoryInversion;SensoryInversion;Sens Inversione
;;"Inverts the target's senses,
causing confusion and stat reversal.";"Inverts the target's senses,
causing confusion and stat reversal.";"Inverte i sensi del bersaglio,
causando confusione e inversione delle statistiche."
;;%1 inverts senses!;%1 inverts senses!;%1 inverte i sensi!
;;FractalGeometry;FractalGeometry;Schema Frattale
;;"Creates a perfect geometric pattern
that shatters reality around the target.";"Creates a perfect geometric pattern
that shatters reality around the target.";"Crea un perfetto schema geometrico
che frantuma la realtà attorno al bersaglio."
;;%1 creates a fractal pattern!;%1 creates a fractal pattern!;%1 crea uno schema frattale!
;;TemporalReversion;TemporalReversion;Tempo Regressione
;;"Reverses the flow of time around a
wound, healing it as if it never existed.";"Reverses the flow of time around a
wound, healing it as if it never existed.";"Inverte il flusso del tempo attorno a una
ferita, guarendola come se non fosse mai esistita."
;;%1 reverses time!;%1 reverses time!;%1 inverte il tempo!
;;ThousandEyedGaze;ThousandEyedGaze;Sguardo Dei Mille Occhi
;;"Summons countless eyes from the void
that gaze upon enemies, causing psychic damage.";"Summons countless eyes from the void
that gaze upon enemies, causing psychic damage.";"Evoca innumerevoli occhi dal vuoto
che scrutano i nemici, causando danni psichici."
;;%1 summons watching eyes!;%1 summons watching eyes!;%1 evoca occhi che osservano!
;;Revelations;Revelations;Rivelazioni
;;"Forces the target to witness an
unknowable truth, potentially driving them mad.";"Forces the target to witness an
unknowable truth, potentially driving them mad.";"Costringe il bersaglio a scoprire una
verità sconosciuta, potenzialmente facendolo impazzire."
;;%1 reveals an unknowable truth!;%1 reveals an unknowable truth!;%1 rivela una verità sconosciuta!
;;Quantum Duplication;Quantum Duplication;Duplicazione Quantica
;;"Splits the caster into multiple
quantum versions that exist simultaneously.";"Splits the caster into multiple
quantum versions that exist simultaneously.";"Divide il lanciatore in più
versioni quantistiche che esistono simultaneamente."
;;%1 creates quantum duplicates!;%1 creates quantum duplicates!;%1 crea duplicati quantici!
;;Reality-Warping Melody;Reality-Warping Melody;Melodia deforma-realtà
;;"Creates discordant music that makes
reality itself unstable around enemies.";"Creates discordant music that makes
reality itself unstable around enemies.";"Crea una musica dissonante che rende
instabile la realtà stessa attorno ai nemici."
;;%1 plays discordant notes!;%1 plays discordant notes!;%1 suona note discordanti!
;;Pain Transmutation;Pain Transmutation;Trasmutazione del dolore
;;"Channels pain into power, dealing damage
based on the caster's missing HP.";"Channels pain into power, dealing damage
based on the caster's missing HP.";"Trasforma il dolore in potere, infliggendo danni
in base ai PS mancanti dell'incantatore."
;;%1 channels pain into power!;%1 channels pain into power!;%1 trasforma il dolore in potere!
;;Identity Transference;Identity Transference;Trasferimento di identità
;;"Swaps positions and some aspects
of identity between caster and target.";"Swaps positions and some aspects
of identity between caster and target.";"Scambia le posizioni e alcuni aspetti
dell'identità tra l'incantatore e il bersaglio."
;;%1 performs identity transference!;%1 performs identity transference!;%1 esegue trasferisce la sua identità!
;;Probability Manipulation;Probability Manipulation;Manipolazione della probabilità
;;"Creates a field where probability itself
is manipulated in the caster's favor.";"Creates a field where probability itself
is manipulated in the caster's favor.";"Crea un campo in cui la probabilità stessa
viene manipolata a favore di chi lancia l'incantesimo."
;;%1 manipulates probability!;%1 manipulates probability!;%1 manipola la probabilità!
;;Non-Euclidean Fluid;Non-Euclidean Fluid;Fluido non euclideo
;;"Summons a liquid that flows
against gravity and dissolves reality.";"Summons a liquid that flows
against gravity and dissolves reality.";"Evoca un liquido che scorre
contro la gravità e dissolve la realtà."
;;%1 summons non-euclidean fluid!;%1 summons non-euclidean fluid!;%1 evoca un fluido non euclideo!
