Change;Excluded;Original;en;it
;;"A perfect acorn cap that, when
worn as a ring, allows the wearer
to understand the whispers of trees and forest creatures.";"A perfect acorn cap that, when
worn as a ring, allows the wearer
to understand the whispers of trees and forest creatures.";"Un perfetto copricapo a forma di ghianda che,
indossato come anello, permette a chi lo indossa
di comprendere i sussurri degli alberi e delle creature della foresta."
;;Fae Bell of Summoning;Fae Bell of Summoning;Campana fatata dell'evocazione
;;"A tiny bell that makes no 
sound when shaken by mortals,
but summons invisible helpers when in true need.";"A tiny bell that makes no 
sound when shaken by mortals,
but summons invisible helpers when in true need.";"Una piccola campana che non emette alcun
suono quando viene scossa dai mortali,
ma evoca aiutanti invisibili quando è davvero in difficoltà."
;;Everbloom Rose;Everbloom Rose;Rosa sempreverde
;;"A rose that never dies, 
cultivated in the Queen of Summer's garden.";"A rose that never dies, 
cultivated in the Queen of Summer's garden.";"Una rosa che non muore mai,
coltivata nel giardino della Regina dell'Estate."
;;Quickgrowth Seed;Quickgrowth Seed;Semi a crescita rapida
;;"A mysterious seed that sprouts
instantly when planted,
creating a small shelter of living branches and leaves for one night.";"A mysterious seed that sprouts
instantly when planted,
creating a small shelter of living branches and leaves for one night.";"Un seme misterioso che germoglia
all'istante quando viene piantato,
creando un piccolo riparo di rami e foglie vive per una notte."
;;Truth-seeing Glass;Truth-seeing Glass;Vetro della veritò
;;"A mirror fashioned from polished 
moonstone that reveals secrets,";"A mirror fashioned from polished 
moonstone that reveals secrets,";"Uno specchio ricavato da pietra di luna
lucida che rivela segreti,"
;;Fungi Chalice;Fungi Chalice;Calice di funghi
;;"A goblet carved from a single 
mushroom cap that refills with sweet nectar
once per day.";"A goblet carved from a single 
mushroom cap that refills with sweet nectar
once per day.";"Un calice ricavato da un singolo
cappello di fungo che si riempie di dolce nettare
una volta al giorno."
;;Faesoil Pouch;Faesoil Pouch;Sacchetto di terra incantana
;;"A small pouch of enchanted 
soil from the heart of the Fae realm.";"A small pouch of enchanted 
soil from the heart of the Fae realm.";"Un piccolo sacchetto di terra incantata
proveniente dal cuore del regno delle Fate."
;;Memory Amber;Memory Amber;Ambra della memoria
;;"A butterfly preserved in amber
that, when crushed, releases memories
of ancient forests and forgotten pathways through the wilderness.";"A butterfly preserved in amber
that, when crushed, releases memories
of ancient forests and forgotten pathways through the wilderness.";"Una farfalla conservata nell'ambra
che, una volta schiacciata, libera ricordi
di antiche foreste e sentieri dimenticati nella natura selvaggia."
;;Seer's Thimble;Seer's Thimble;Ditale del veggente
;;"A small silver thimble filled 
with rainwater.";"A small silver thimble filled 
with rainwater.";"Un piccolo ditale d'argento riempito
di acqua piovana."
;;Moonflower Crown;Moonflower Crown;Corona di fiori di luna
;;"A delicate crown woven from 
moonflowers that bloom only
at midnight.";"A delicate crown woven from 
moonflowers that bloom only
at midnight.";"Una delicata corona intrecciata con
fiori di luna che sbocciano solo
a mezzanotte."
;;Alchemist's Catalyst;Alchemist's Catalyst;Catalizzatore dell'alchimista
;;"A vial of catalyst created by 
a master alchemist.";"A vial of catalyst created by 
a master alchemist.";"Una fiala di catalizzatore creata da
un maestro alchimista."
;;Scribe's Prismatic Ink;Scribe's Prismatic Ink;Inchiostro prismatico dello scriba
;;"A specialty ink made from rare
minerals and creatures.";"A specialty ink made from rare
minerals and creatures.";"Un inchiostro speciale ricavato da
minerali e creature rare."
;;Astronomer's Astrolabe;Astronomer's Astrolabe;Astrolabio dell'astronomo
;;"A precision instrument used by
astronomers to calculate celestial positions.";"A precision instrument used by
astronomers to calculate celestial positions.";"Uno strumento di precisione utilizzato
dagli astronomi per calcolare le posizioni celesti."
;;Physician's Instrument Set;Physician's Instrument Set;Set di strumenti chirurgici
;;"A set of masterfully crafted 
surgical tools.";"A set of masterfully crafted 
surgical tools.";"Un set di strumenti chirurgici 
realizzati con maestria."
;;Jeweler's Loupe;Jeweler's Loupe;Lente d'ingrandimento da gioielliere
;;"A specialized lens crafted by 
a master jeweler.";"A specialized lens crafted by 
a master jeweler.";"Una lente speciale realizzata da
un maestro gioielliere."
;;Blacksmith's Flux;Blacksmith's Flux;Flusso del fabbro
;;"A complex mixture of herbs and
minerals used by blacksmiths.";"A complex mixture of herbs and
minerals used by blacksmiths.";"Una miscela complessa di erbe e
minerali utilizzata dai fabbri."
;;Botanist's Seed Collection;Botanist's Seed Collection;Collezione di semi del botanico
;;"A leather pouch containing 
various seeds from rare and magical plants.";"A leather pouch containing 
various seeds from rare and magical plants.";"Un sacchetto di pelle contenente
vari semi di piante rare e magiche."
;;Scholar's Legal Tome;Scholar's Legal Tome;Tomo legale dello studioso
;;"A large book containing common
laws and legal precedents.";"A large book containing common
laws and legal precedents.";"Un grande libro contenente leggi
comuni e precedenti legali."
;;Potter's Enchanted Clay;Potter's Enchanted Clay;Argilla incantata del vasaio
;;"A specially prepared clay used
by potters.";"A specially prepared clay used
by potters.";"Un'argilla appositamente preparata e utilizzata
dai ceramisti."
;;Leatherworker's Travel Pack;Leatherworker's Travel Pack;Zaino da viaggio per pellettieri
;;"A finely crafted backpack with
numerous secret compartments.";"A finely crafted backpack with
numerous secret compartments.";"Uno zaino finemente lavorato con
numerosi scomparti segreti."
;;Bladesmith's Eternal Whetstone;Bladesmith's Eternal Whetstone;Cote eterna del fabbro
;;"An exceptional whetstone that 
never wears down.";"An exceptional whetstone that 
never wears down.";"Una pietra per affilare eccezionale che
non si consuma mai."
;;Chef's Spice Blend;Chef's Spice Blend;Miscela di spezie dello chef
;;"A collection of rare spices 
and herbs prepared by a master chef.";"A collection of rare spices 
and herbs prepared by a master chef.";"Una collezione di spezie rare
ed erbe aromatiche preparate da uno chef provetto."
;;Painter's Arcane Palette;Painter's Arcane Palette;Tavolozza arcana del pittore
;;"A otherwordly crafted set of 
brushes and pigments.";"A otherwordly crafted set of 
brushes and pigments.";Un set di pennelli e pigmenti realizzati in modo ultraterreno.
;;Polar Blubber Oil;Polar Blubber Oil;Olio di grasso polare
;;"A vial of oil rendered from 
the blubber of arctic mammals.";"A vial of oil rendered from 
the blubber of arctic mammals.";"Una fiala di olio ricavato
dal grasso dei mammiferi artici."
;;Glacial Heart Crystal;Glacial Heart Crystal;Cristallo di cuore glaciale
;;"A crystal formed from ancient 
glacial ice that never melts.";"A crystal formed from ancient 
glacial ice that never melts.";"Un cristallo formato da antichi
ghiacci glaciali che non si sciolgono mai."
;;Frostseeker's Lens;Frostseeker's Lens;Lente del Cercatore di Gelo
;;"A carefully constructed lens 
made from perfectly clear ice.";"A carefully constructed lens 
made from perfectly clear ice.";"Una lente costruita con cura
realizzata in ghiaccio perfettamente trasparente."
;;Snow Moss Tea;Snow Moss Tea;Tè al muschio di neve
;;"A rare moss that grows beneath
the snow in the far north.";"A rare moss that grows beneath
the snow in the far north.";"Un muschio raro che cresce sotto
la neve nell'estremo nord."
;;Frost Bear Talisman;Frost Bear Talisman;Talismano dell'orso gelido
;;"A tooth from the fearsome 
northern frost bear.";"A tooth from the fearsome 
northern frost bear.";"Un dente del temibile
orso del gelo settentrionale."
;;Northern Pemmican;Northern Pemmican;Pemmican settentrionale
;;"A preserved mixture of dried 
arctic berries high in nutrients.";"A preserved mixture of dried 
arctic berries high in nutrients.";"Una miscela conservata di bacche artiche essiccate
ricche di nutrienti."
;;Snowhare Weave;Snowhare Weave;Pelliccia di lepre artica
;;"A thin but incredibly warm 
fabric woven from the fur of arctic hares.";"A thin but incredibly warm 
fabric woven from the fur of arctic hares.";"Un tessuto sottile ma incredibilmente caldo
tessuto con la pelliccia delle lepri artiche."
;;Aurora Essence;Aurora Essence;Essenza dell'aurora
;;"A luminescent liquid that 
flows beneath the polar ice.";"A luminescent liquid that 
flows beneath the polar ice.";"Un liquido luminescente che
scorre sotto i ghiacci polari."
;;Wayfinder's Drum;Wayfinder's Drum;Tamburo del viaggiatore
;;"A traditional drum made from 
stretched human skin.";"A traditional drum made from 
stretched human skin.";"Un tamburo tradizionale fatto di
pelle umana stirata."
;;Igloo Building Blocks;Igloo Building Blocks;Blocchi da costruzione Igloo
;;"Specialized snow used by 
northern tribes to build emergency shelters.";"Specialized snow used by 
northern tribes to build emergency shelters.";"Neve speciale utilizzata dalle
tribù del nord per costruire rifugi di emergenza."
;;Perfect Snowflake;Perfect Snowflake;Fiocco di neve perfetto
;;"A single snowflake preserved 
in its perfect crystalline form.";"A single snowflake preserved 
in its perfect crystalline form.";"Un singolo fiocco di neve conservato
nella sua perfetta forma cristallina."
;;Frost Nomad's Map;Frost Nomad's Map;Mappa del Nomade del Gelo
;;"A map inscribed on cured 
sealskin showing hidden passages through the arctic.";"A map inscribed on cured 
sealskin showing hidden passages through the arctic.";"Una mappa incisa su pelle di foca
stagionata che mostra passaggi nascosti attraverso l'Artico."
;;Hearty Arctic Stew;Hearty Arctic Stew;Stufato artico sostanzioso
;;"A specially prepared meal from
Alaska that generates internal heat.";"A specially prepared meal from
Alaska that generates internal heat.";"Un pasto preparato appositamente
dall'Alaska che genera calore interno."
;;Monarch Toxin Wing;Monarch Toxin Wing;Ala della tossina monarca
;;"A vibrant butterfly wing with 
natural toxins.";"A vibrant butterfly wing with 
natural toxins.";"Un'ala di farfalla vibrante con
tossine naturali."
;;Jaguar Musk Gland;Jaguar Musk Gland;Ghiandola del muschio del giaguaro
;;"The powerful musk gland from a
jungle predator.";"The powerful musk gland from a
jungle predator.";"La potente ghiandola muschiata di un
predatore della giungla."
;;Titan Beetle Carapace;Titan Beetle Carapace;Carapace di coleottero titano
;;"A sturdy shell from a giant 
jungle beetle.";"A sturdy shell from a giant 
jungle beetle.";"Un robusto guscio di un gigantesco
coleottero della giungla."
;;Emerald Viper Venom;Emerald Viper Venom;Veleno di vipera smeraldo
;;"Concentrated venom from a rare
jungle snake.";"Concentrated venom from a rare
jungle snake.";"Veleno concentrato di un raro
serpente della giungla."
;;Heart of the Jungle;Heart of the Jungle;Cuore della giungla
;;"A strange fruit that grows 
only in the deepest jungle.";"A strange fruit that grows 
only in the deepest jungle.";"Uno strano frutto che cresce
solo nella giungla più profonda."
;;Paradise Feather;Paradise Feather;Piuma del Paradiso
;;"The iridescent feather from a 
rare tropical bird.";"The iridescent feather from a 
rare tropical bird.";"La piuma iridescente di un
raro uccello tropicale."
;;Banyan Sap;Banyan Sap;Linfa di Banyan
;;"The sap of an ancient tree 
that absorbs ambient magical energy.";"The sap of an ancient tree 
that absorbs ambient magical energy.";"La linfa di un albero antico
che assorbe l'energia magica ambientale."
;;Alpha Panther Claw;Alpha Panther Claw;Artiglio di Pantera Alfa
;;"A claw from the mighty jungle 
apex predator.";"A claw from the mighty jungle 
apex predator.";"Un artiglio del potente
predatore al vertice della giungla."
;;Luminous Spores;Luminous Spores;Spore luminose
;;"Spores collected from 
luminescent fungi that grow in dark jungle caves.";"Spores collected from 
luminescent fungi that grow in dark jungle caves.";"Spore raccolte da
funghi luminescenti che crescono nelle grotte buie della giungla."
;;Golden Vocal Sac;Golden Vocal Sac;Sacca vocale dorata
;;"The vocal sac from a rare 
species of tree frog.";"The vocal sac from a rare 
species of tree frog.";"Il sacco vocale di una rara
specie di raganella."
;;Royal Meat Honey;Royal Meat Honey;Miele di carne reale
;;"A specialized honey produced 
from carnivourous plants";"A specialized honey produced 
from carnivourous plants";"Un miele specializzato prodotto
da piante carnivore"
;;Serpent Gastrolith;Serpent Gastrolith;Gastrolite di serpente
;;"A peculiar stone found in the 
stomach of an ancient snake.";"A peculiar stone found in the 
stomach of an ancient snake.";"Una pietra particolare trovata nello
stomaco di un antico serpente."
;;Moonphase Tree Resin;Moonphase Tree Resin;Resina lunare
;;"Rare resin that drips from 
trees only during specific lunar phases.";"Rare resin that drips from 
trees only during specific lunar phases.";"Resina rara che gocciola dagli
alberi solo durante specifiche fasi lunari."
;;Nightstalker's Eye;Nightstalker's Eye;Occhio del cacciatore notturno
;;"The eye of a jungle predator 
that hunts in complete darkness.";"The eye of a jungle predator 
that hunts in complete darkness.";"L'occhio di un predatore della giungla
che caccia nella completa oscurità."
;;Journalist's Endless Notepad;Journalist's Endless Notepad;Blocco note infinito del giornalista
;;"A high-quality notepad with 
special paper that never runs out.";"A high-quality notepad with 
special paper that never runs out.";"Un blocco note di alta qualità con
carta speciale che non si esaurisce mai."
;;Deadline Coffee;Deadline Coffee;Caffè deadline
;;"A premium blend of coffee that
keeps the mind sharp and alert.";"A premium blend of coffee that
keeps the mind sharp and alert.";"Una miscela di caffè pregiata che
mantiene la mente acuta e vigile."
;;Investigator's Camera;Investigator's Camera;Telecamera dell'investigatore
;;"A compact camera with 
exceptional clarity and zoom capabilities.";"A compact camera with 
exceptional clarity and zoom capabilities.";"Una fotocamera compatta con
eccezionale nitidezza e capacità di zoom."
;;Truth-Revealing Solution;Truth-Revealing Solution;Soluzione della verità
;;"A set of specialized chemicals
that reveal hidden text and fingerprints.";"A set of specialized chemicals
that reveal hidden text and fingerprints.";"Un insieme di sostanze chimiche specializzate
che rivelano testi e impronte digitali nascosti."
;;Press Badge Collection;Press Badge Collection;Raccolta di credenziali
;;"A collection of press 
credentials from various organizations.";"A collection of press 
credentials from various organizations.";"Una raccolta di credenziali stampa
di varie organizzazioni."
;;Invisible Ink Pen;Invisible Ink Pen;Penna a inchiostro invisibile
;;"A specially formulated ink 
that renders writing temporarily invisible.";"A specially formulated ink 
that renders writing temporarily invisible.";"Un inchiostro appositamente formulato
che rende la scrittura temporaneamente invisibile."
;;Covert Recorder;Covert Recorder;Registratore nascosto
;;"A compact audio recorder with 
enhanced sensitivity and noise filtering.";"A compact audio recorder with 
enhanced sensitivity and noise filtering.";"Un registratore audio compatto con
sensibilità migliorata e filtro del rumore."
;;Orator's Elixir;Orator's Elixir;Elisir dell'Oratore
;;"A specialized tonic that 
heightens mental acuity and verbal eloquence.";"A specialized tonic that 
heightens mental acuity and verbal eloquence.";"Un tonico specializzato che
aumenta l'acutezza mentale e l'eloquenza verbale."
;;Informant Network Directory;Informant Network Directory;Directory della rete di informatori
;;"A network of contacts in 
various sectors of society.";"A network of contacts in 
various sectors of society.";"Una rete di contatti in
vari settori della società."
;;Undercover Disguise Kit;Undercover Disguise Kit;Kit di travestimento sotto copertura
;;"A small kit containing 
disguise materials and quick-change accessories.";"A small kit containing 
disguise materials and quick-change accessories.";"Un piccolo kit contenente
materiali per il travestimento e accessori a cambio rapido."
;;Calming Tea;Calming Tea;Tè calmante
;;"A specially crafted herbal tea
that calms nerves and restores focus.";"A specially crafted herbal tea
that calms nerves and restores focus.";"Una tisana appositamente preparata
che calma i nervi e ripristina la concentrazione."
;;Field Analysis Kit;Field Analysis Kit;Kit di analisi sul campo
;;"A portable device that can 
detect and analyze various substances.";"A portable device that can 
detect and analyze various substances.";"Un dispositivo portatile in grado
di rilevare e analizzare varie sostanze."
;;Memory Sage;Memory Sage;Salvia della memoria
;;"A rare herb that enhances 
memory and helps organize thoughts.";"A rare herb that enhances 
memory and helps organize thoughts.";"Un'erba rara che migliora
la memoria e aiuta a organizzare i pensieri."
;;Investigative Laptop;Investigative Laptop;Laptop investigativo
;;"A compact, durable laptop with
specialized software for investigations.";"A compact, durable laptop with
specialized software for investigations.";"Un portatile compatto e resistente con
software specializzato per le indagini."
;;Precision Digital Scale;Precision Digital Scale;Bilancia digitale di precisione
;;"A digital scale with perfect 
accuracy and tamper-proof calibration.";"A digital scale with perfect 
accuracy and tamper-proof calibration.";"Una bilancia digitale con perfetta
precisione e calibrazione a prova di manomissione."
;;Discrete Packaging Kit;Discrete Packaging Kit;Kit di imballaggio discreto
;;"A collection of small, 
unmarked packaging materials.";"A collection of small, 
unmarked packaging materials.";"Una raccolta di piccoli
materiali da imballaggio non contrassegnati."
;;Street Network Contacts;Street Network Contacts;Contatti della rete stradale
;;"A network of reliable street 
informants who provide crucial intelligence.";"A network of reliable street 
informants who provide crucial intelligence.";"Una rete di informatori di strada affidabili
che forniscono informazioni cruciali."
;;Underground Energy Drink;Underground Energy Drink;Bevanda energetica sotterranea
;;"A synthetically enhanced 
energy beverage that keeps you alert and focused.";"A synthetically enhanced 
energy beverage that keeps you alert and focused.";"Una bevanda energetica arricchita sinteticamente
che ti mantiene vigile e concentrato."
;;Encrypted Burner Phone;Encrypted Burner Phone;Telefono usa e getta crittografato
;;"A specially modified 
smartphone with encryption and secure messaging.";"A specially modified 
smartphone with encryption and secure messaging.";"Uno smartphone appositamente modificato
con crittografia e messaggistica sicura."
;;Trace Removal Powder;Trace Removal Powder;Polvere per la rimozione delle tracce
;;"A specialized powder that 
eliminates fingerprints and DNA traces.";"A specialized powder that 
eliminates fingerprints and DNA traces.";"Una polvere specializzata che
elimina impronte digitali e tracce di DNA."
;;False Identity Kit;False Identity Kit;Kit per le false identità
;;"A collection of fake IDs, 
licenses, and credentials.";"A collection of fake IDs, 
licenses, and credentials.";"Una raccolta di documenti d'identità,
patenti e credenziali falsi."
;;Negotiator's Manual;Negotiator's Manual;Manuale del negoziatore
;;Convinces the enemy to leave you alone.;Convinces the enemy to leave you alone.;Convince il nemico a lasciarti in pace.
;;Secure Transport Case;Secure Transport Case;Valigetta per trasporto sicura
;;"A reinforced briefcase with 
hidden compartments and alarm features.";"A reinforced briefcase with 
hidden compartments and alarm features.";"Una valigetta rinforzata con
scomparti nascosti e funzioni di allarme."
;;Premium Samples;Premium Samples;Campioni Premium
;;"A collection of premium perfume
samples used to showcase product quality.";"A collection of premium perfume
samples used to showcase product quality.";"Una collezione di campioni di profumi di alta qualità
utilizzati per mettere in mostra la qualità del prodotto."
;;Encrypted Ledger;Encrypted Ledger;Registro crittografato
;;"A notebook containing coded 
records of transactions and clients.";"A notebook containing coded 
records of transactions and clients.";"Un quaderno contenente registrazioni codificate
di transazioni e clienti."
;;Street Blend;Street Blend;Mix da strada
;;"A potent chemical mixture that 
heightens awareness and reflexes.";"A potent chemical mixture that 
heightens awareness and reflexes.";"Una potente miscela chimica che
aumenta la consapevolezza e i riflessi."
;;Urban Escape Routes Map;Urban Escape Routes Map;Mappa delle vie di fuga urbane
;;"A collection of routes and 
safe houses throughout the omega tower.";"A collection of routes and 
safe houses throughout the omega tower.";"Una raccolta di percorsi e
rifugi sicuri in tutta la torre Omega."
;;Product Testing Kit;Product Testing Kit;Kit per testing
;;"A specialized kit for testing 
product purity and composition.";"A specialized kit for testing 
product purity and composition.";"Un kit specializzato per testare
la purezza e la composizione del prodotto."
;;"A hearty stew with chunks of 
meat and vegetables.";"A hearty stew with chunks of 
meat and vegetables.";"Uno stufato sostanzioso con pezzi di
carne e verdure."
;;Fresh Bread;Fresh Bread;Pane fresco
;;"A freshly baked loaf of 
bread.
Simple but satisfying.";"A freshly baked loaf of 
bread.
Simple but satisfying.";"Una pagnotta di pane appena sfornata.
Semplice ma appagante."
;;Crisp Apple;Crisp Apple;Mela croccante
;;"A juicy apple that's perfectly
ripe.";"A juicy apple that's perfectly
ripe.";"Una mela succosa e perfettamente
matura."
;;Cheese Wheel;Cheese Wheel;Forma di formaggio
;;"A wheel of cheese made from 
farm-fresh milk.
Rich and filling.";"A wheel of cheese made from 
farm-fresh milk.
Rich and filling.";"Una forma di formaggio prodotta con
latte fresco di fattoria.
Ricca e sostanziosa."
;;Grilled Fish;Grilled Fish;Pesce alla griglia
;;"Grilled fish caught from local
waters.";"Grilled fish caught from local
waters.";"Pesce alla griglia pescato nelle acque
locali."
;;Wild Honey;Wild Honey;Miele selvatico
;;"A bottle of sweet honey 
harvested from forest hives.";"A bottle of sweet honey 
harvested from forest hives.";"Una bottiglia di miele dolce
raccolto dagli alveari della foresta."
;;Mixed Nuts;Mixed Nuts;Noci miste
;;"Crunchy nuts gathered from 
ancient trees.";"Crunchy nuts gathered from 
ancient trees.";"Noci croccanti raccolte da
alberi secolari."
;;Fruit Pastry;Fruit Pastry;Pasticceria alla frutta
;;"A sweet pastry filled with 
fruit jam.";"A sweet pastry filled with 
fruit jam.";"Un dolce ripieno di
confettura di frutta."
;;Herbal Tea;Herbal Tea;Tisana
;;"A refreshing medicinal tea 
made from rare herbs.";"A refreshing medicinal tea 
made from rare herbs.";"Una tisana medicinale rinfrescante
a base di erbe rare."
;;Spicy Curry;Spicy Curry;Curry piccante
;;"A spicy dish that sets the 
taste buds on fire.";"A spicy dish that sets the 
taste buds on fire.";"Un piatto piccante che infiamma
le papille gustative."
;;Wild Berries;Wild Berries;Bacche selvatiche
;;"A handful of berries picked 
from mountain bushes.";"A handful of berries picked 
from mountain bushes.";"Una manciata di bacche raccolte
dai cespugli di montagna."
;;Wisdom Elixir;Wisdom Elixir;Elisir di saggezza
;;"A ceremonial drink brewed from
ancient recipes.";"A ceremonial drink brewed from
ancient recipes.";"Una bevanda cerimoniale preparata
secondo antiche ricette."
;;Roasted Vegetables;Roasted Vegetables;Verdure arrostite
;;"A roasted vegetable dish with 
savory herbs.";"A roasted vegetable dish with 
savory herbs.";"Un piatto di verdure arrostite con
erbe aromatiche."
;;Gourmet Chocolate;Gourmet Chocolate;Cioccolato gourmet
;;"A luxurious chocolate dessert 
made by master confectioners.";"A luxurious chocolate dessert 
made by master confectioners.";"Un lussuoso dessert al cioccolato
preparato da maestri pasticceri."
;;Meat Pie;Meat Pie;Torta di carne
;;"A hearty meat pie with flaky 
crust.";"A hearty meat pie with flaky 
crust.";"Una sostanziosa torta di carne con una crosta
sfogliata."
;;Spring Water;Spring Water;Acqua di sorgente
;;"Clear, refreshing water from a
mountain spring.";"Clear, refreshing water from a
mountain spring.";"Acqua limpida e rinfrescante da una
sorgente di montagna."
;;Berry Punch;Berry Punch;Punch di bacche
;;"A sweet and tangy fruit punch 
made from local berries.";"A sweet and tangy fruit punch 
made from local berries.";"Un punch alla frutta dolce e aspro
fatto con bacche locali."
;;Fresh Milk;Fresh Milk;Latte fresco
;;"A thick, creamy milk from 
grass-fed cows.";"A thick, creamy milk from 
grass-fed cows.";"Un latte denso e cremoso proveniente
da mucche nutrite ad erba."
;;Mint Tea;Mint Tea;Tè alla menta
;;"A soothing herbal tea with 
minty undertones.";"A soothing herbal tea with 
minty undertones.";"Una tisana rilassante con
sfumature di menta."
;;Fresh Lemonade;Fresh Lemonade;Limonata fresca
;;"A bright, citrusy lemonade 
made from fresh lemons.";"A bright, citrusy lemonade 
made from fresh lemons.";"Una limonata vivace e agrumata
fatta con limoni freschi."
;;Strong Coffee;Strong Coffee;Caffè forte
